{
  "id": "towerdefence",
  "enabled": true,
  "fleetName": "towerdefence",

  "priority": 125,

  "friendlyName": "TowerDefence",
  "activityNoun": "playing",

  "minPlayers": 2,
  "maxPlayers": 12,

  "displayItem": {
    "material": "minecraft:totem_of_undying",
    "slot": 20,
    "name": "<gradient:#ffb70f:#ffcd17:#ffb70f><bold>TowerDefence</bold></gradient>",
    "lore": [
      "<gray>Towerdefence is a fast-paced PvP game where</gray>",
      "<gray>quick reflexes and strategic tower building</gray>",
      "<gray>are essentialto fend off enemy mobs and stay</gray>",
      "<gray>ahead of the competition.</gray>"
    ]
  },

  "displayNpc": {
    "entityType": "PLAYER",
    "titles": [
      "<gradient:#ffb70f:#ffcd17:#ffb70f><bold>TowerDefence</bold></gradient>"
    ],
    "skin": {
      "texture": "ewogICJ0aW1lc3RhbXAiIDogMTYyMDQ4MzM1ODQ2OSwKICAicHJvZmlsZUlkIiA6ICI1NjY3NWIyMjMyZjA0ZWUwODkxNzllOWM5MjA2Y2ZlOCIsCiAgInByb2ZpbGVOYW1lIiA6ICJUaGVJbmRyYSIsCiAgInNpZ25hdHVyZVJlcXVpcmVkIiA6IHRydWUsCiAgInRleHR1cmVzIiA6IHsKICAgICJTS0lOIiA6IHsKICAgICAgInVybCIgOiAiaHR0cDovL3RleHR1cmVzLm1pbmVjcmFmdC5uZXQvdGV4dHVyZS9mMjUxNjljNGM4YmUyYjc4MWQyNzE0ZDA5M2I0ZDc2MTA3MTFmMWZmMTlkZjYyYjg2MjZjMzNmZWNjZGY3Yjg5IgogICAgfQogIH0KfQ==",
      "signature": "laCteZJ6UWQOot+RUG011rFs1g5AnZX1tSJEXeia658pNkOrbTNfXS1GK9KQYROg4bFK1VQ/S0N/qbIbQgPJwvoKUJjNExm4D8MKuiFilfk5YolZgkUIfD6ff6dv/wfuU36Zx21UZjDwqRPcIfmcPI2trrp3qmoH6H/6Qh1z9GlI7emK437jgEQSjkCanP9U4/iJ5lrUVt+phKVhXT/RsVeIqUzuCwD7YoTAQAErCdrTdkNfk8e8utIyPdafmLhASaoUarpspi2pbg0QrgnBQlXEl9l3nNJ89dwxRuy0YiMEgHdnzd++Rj6JVvk/d55T1EK5ymm2gICLsZUJidxemmSlS2vkSifHRlMbcWbWrDDPj2svbv9/707jDGJ6XV1ZCdCh0JZTvb1QKavKFypgfC6hipwStTuqskwp3Kq6d65F1QkNxBUsH4jFk1Re5TTAT6qp4D8C5vyUHUBJD35ypdRG3OjZl2a9iH2RWIvmHoYkAc3awxcJD75olX0HNoZ58Yex7x9g0cg/kiT76/g936YxM1rmxo6s21jQh/GsRyS2zsy9OGY8ivqb2UJ0alwPzwtDPLHgyYYk3NTay02N/iwWeo46uuhP7P3erTumjPYoGM6gtwcILdqJqkT27BuRYcyCFg/K9CzV9mdqOFu/vA7jBLEutDv+kC/l7UC/FnU="
    }
  },

  "partyRestrictions": {
    "minSize": 1,
    "maxSize": 12
  },

  "maps": {
    "default": {
      "id": "default",
      "enabled": true,

      "friendlyName": "Default",
      "priority": 100,

      "displayItem": {
        "slot": 0,
        "material": "minecraft:barrier",
        "name": "<green><bold>Default</bold></green>"
      }
    }
  },

  "matchmakerInfo": {
    "matchMethod": "COUNTDOWN",
    "selectMethod": "AVAILABLE",
    "rate": 750000000
  }
}
