{
  "id": "marathon",
  "enabled": true,
  "fleetName": "marathon",

  "priority": 105,

  "friendlyName": "Marathon",
  "activityNoun": "playing",

  "minPlayers": 1,
  "maxPlayers": 100,

  "displayItem": {
    "material": "minecraft:grass_block",
    "slot": 16,
    "name": "<red><bold>Marathon</bold></red>",
    "lore": [
      "<gray>An infinitely generating,",
      "<gray>endless parkour gamemode.",
      "<gray>See how far you can go!"
    ]
  },

  "displayNpc": {
    "entityType": "PLAYER",
    "titles": [
      "<red><bold>Marathon</bold></red>"
    ],
    "skin": {
      "texture": "ewogICJ0aW1lc3RhbXAiIDogMTcyNDI5Mzc1MTM4NywKICAicHJvZmlsZUlkIiA6ICIyMjYwMWIxMGY0MTc0ZjA3OWIwYWM2MGE5NGEzOTBmYiIsCiAgInByb2ZpbGVOYW1lIiA6ICJ1bmRlcmdhbWVndXkiLAogICJzaWduYXR1cmVSZXF1aXJlZCIgOiB0cnVlLAogICJ0ZXh0dXJlcyIgOiB7CiAgICAiU0tJTiIgOiB7CiAgICAgICJ1cmwiIDogImh0dHA6Ly90ZXh0dXJlcy5taW5lY3JhZnQubmV0L3RleHR1cmUvODIyOWI4ZTVjYWM0OGE5OGY1ZjQxOTIzYjcxMWJkMjYwMzdlOGFiNzVkMDQ3ZTM1ZGQ2ZTFmYmRhMGJlY2FkNyIKICAgIH0KICB9Cn0=",
      "signature": "J+TIgPB/VFJEucLlUrFzpQM6sXYS2nZ43JCaBfmY7gXRR+0SRfHsc5bSKGALAP+Rydict3yg2ixfkOEC61LijpcgfsQBVpRuqIm837E9wEG6KwSTRRw3ydLvMTYIr6JKIE5OCsn37FC97Tf0MVR6CgzGyQySFhbLEXNTDr+5LF0DWtXR+TzDngupXqzf2ZqWxvkFdhv6mTFAYdRVbxN9AQRaFGyEcBi9f4nHsVnB7o6WoJWpy7XsSEQR7BmUzDijs6R42RAdoLerF47aDDJBiMNDLcsiTOPzugxJ9vGqpQtkw5cnZbjSvD30KtQPLtCFgDek+RaRIv0v48FERigk7rR1EIIHybJ8ODUu9mfMhQ6skEZsYg5vE+v/ybHC/5nqmQYR1C1thqzPRLUBT+ZqnjuC72RK4eh9OlJ1Usrla3/YJ630+8/Pmlu4K1VapQX+mZEuT1/Hk7QBPvzLBqkgRnkyD5o3kd8XHWJzp0s5J3qXSTfdJCznbTKD2tl7xkkimUJAciO0Tazg7x/UkNRL+0f5a9jhFJAZprNg1hV1jRlGiJJT1MUxziZ2EYOx8mMJ9H9S4JMT7JRITDXsCO6C2EF+HemHAN1GQBOQ1y0L1usu7nML1mthVUB9FSjcJ1C1m4fNY7tEb7eGHkvN5uH7MWmw7943wwIbv3xb6W5KDHU="
    }
  },

  "partyRestrictions": {
    "minSize": 1,
    "maxSize": 100
  },

  "matchmakerInfo": {
    "matchMethod": "INSTANT",
    "selectMethod": "PLAYER_COUNT",
    "rate": 175000000
  }
}
