{
  "id": "lazertag",
  "enabled": true,
  "fleetName": "lazertag",

  "priority": 110,

  "friendlyName": "LazerTag",
  "activityNoun": "playing",

  "minPlayers": 2,
  "maxPlayers": 12,

  "displayItem": {
    "material": "minecraft:netherite_hoe",
    "slot": 11,
    "name": "<gradient:gold:yellow><bold>LazerTag</bold></gradient>",
    "lore": [
      "<gray>Battle it out with weird and wacky guns.",
      "<gray>The first player to 25 kills wins!"
    ]
  },

  "displayNpc": {
    "entityType": "PLAYER",
    "titles": [
      "<gradient:gold:yellow><bold>LazerTag</bold></gradient>"
    ],
    "skin": {
      "texture": "ewogICJ0aW1lc3RhbXAiIDogMTYxNDA3NzE5MzQ4MiwKICAicHJvZmlsZUlkIiA6ICJkMGI4MjE1OThmMTE0NzI1ODBmNmNiZTliOGUxYmU3MCIsCiAgInByb2ZpbGVOYW1lIiA6ICJqYmFydHl5IiwKICAic2lnbmF0dXJlUmVxdWlyZWQiIDogdHJ1ZSwKICAidGV4dHVyZXMiIDogewogICAgIlNLSU4iIDogewogICAgICAidXJsIiA6ICJodHRwOi8vdGV4dHVyZXMubWluZWNyYWZ0Lm5ldC90ZXh0dXJlL2E0NjQxMmMzOTgwODZlYzMxMzIxMzlhMTE5NWU0ODNlMGE0OWRmYThiZWMzZWIxNDc0ZjViMTliMTY0NTE4NmUiCiAgICB9CiAgfQp9",
      "signature": "krIl4GecgEcDkkEG2DpUvZWnIqpxhJRcFhkaWYYG9A35u49mGkM3eHJX1ys60lF042EXiPpujonZt4Kp8NF0Hn1WblxfnJUfu1o97Tv7iI+vfB2M/cIfEAKnqVvagPkWvhf6N9TITF7szQc6j0ksMNrFv+gV0NKDZFoQPgw+q+ADGPicQdDpub0rr6hzPmv1H1kNQxDgLGxwIAV4fzVToGKRqLKLCHSMC64d3/GJkrtxQzsvnWji9nD3WJzilLmKN7yjB8Cs1xAWTfxIdayeT/k6pDADyqlRs9PCfGISEwMQKHz0kOqNBDA5J6UB08q7zhO1uZyW4v3QaIXXQeyp7dWkffFdRedcNovmWpiOLnC4u8XF5kFUySkvZg4nMHvO+Vr20uFhxiZ7EWaNt1syfNMDEwiZ8oqljTtbEPUhpj68n1hViThhbatj1XeEa6zSqB1pmDw36q+QQUKX4Q894uDXMr6Gij/1LNJ00rfNoDN43UXt29XPN/qQ1Pj5TXctJdV8zBVhrK60qDpII8miHlslGTTwwpMKgEh5K0JJ5xWtmk4tY4TON0RsQ4RjD+UxmfrPDgOyAXoRxWnPVeUldODbkFHn8wMnK6M/k5g8AFOGOM5h8CfnjDqUeiyZPYC6EihC0dxK9yzPZxe2av27LiHUYDWDs3P5zKVKXRbFaR8="
    }
  },

  "partyRestrictions": {
    "minSize": 1,
    "maxSize": 12
  },

  "matchmakerInfo": {
    "matchMethod": "COUNTDOWN",
    "selectMethod": "AVAILABLE",
    "rate": 2000000000
  }
}
